[
  { "protocolVersion": 1, "type": "editor.ready", "requestId": "10000000-0000-4000-8000-000000000001", "sessionId": "20000000-0000-4000-8000-000000000001", "sessionGeneration": 1, "revision": 0, "payload": { "capabilities": ["chunks-v1", "revision-v1"] } },
  { "protocolVersion": 1, "type": "document.open", "requestId": "10000000-0000-4000-8000-000000000002", "sessionId": "20000000-0000-4000-8000-000000000001", "sessionGeneration": 1, "revision": 0, "payload": { "transferId": "30000000-0000-4000-8000-000000000001", "utf8ByteLength": 11, "sha256": "b94d27b9934d3e08a52e52d7da7dabfac484efe37a5380ee9088f7ace2efcde9" } },
  { "protocolVersion": 1, "type": "document.snapshot.request", "requestId": "10000000-0000-4000-8000-000000000003", "sessionId": "20000000-0000-4000-8000-000000000001", "sessionGeneration": 1, "revision": 4, "payload": { "frozenRevision": 4 } },
  { "protocolVersion": 1, "type": "document.snapshot.response", "requestId": "10000000-0000-4000-8000-000000000003", "sessionId": "20000000-0000-4000-8000-000000000001", "sessionGeneration": 1, "revision": 4, "payload": { "transferId": "30000000-0000-4000-8000-000000000002", "utf8ByteLength": 11, "sha256": "b94d27b9934d3e08a52e52d7da7dabfac484efe37a5380ee9088f7ace2efcde9" } },
  { "protocolVersion": 1, "type": "document.saved", "requestId": "10000000-0000-4000-8000-000000000003", "sessionId": "20000000-0000-4000-8000-000000000001", "sessionGeneration": 1, "revision": 4, "payload": { "durableRevision": 4, "sha256": "b94d27b9934d3e08a52e52d7da7dabfac484efe37a5380ee9088f7ace2efcde9" } },
  { "protocolVersion": 1, "type": "document.saveFailed", "requestId": "10000000-0000-4000-8000-000000000004", "sessionId": "20000000-0000-4000-8000-000000000001", "sessionGeneration": 1, "revision": 5, "payload": { "code": "replaceFailed", "message": "Atomic replacement failed", "retryable": true } },
  { "protocolVersion": 1, "type": "document.externalChange", "requestId": "10000000-0000-4000-8000-000000000005", "sessionId": "20000000-0000-4000-8000-000000000001", "sessionGeneration": 1, "revision": 5, "payload": { "kind": "modified" } },
  { "protocolVersion": 1, "type": "theme.set", "requestId": "10000000-0000-4000-8000-000000000006", "sessionId": "20000000-0000-4000-8000-000000000001", "sessionGeneration": 1, "revision": 5, "payload": { "appearance": "dark" } },
  { "protocolVersion": 1, "type": "error", "requestId": "10000000-0000-4000-8000-000000000007", "sessionId": "20000000-0000-4000-8000-000000000001", "sessionGeneration": 1, "revision": 5, "payload": { "code": "protocolRejected", "message": "Message rejected", "retryable": false } },
  { "protocolVersion": 1, "type": "editor.delta", "requestId": "10000000-0000-4000-8000-000000000008", "sessionId": "20000000-0000-4000-8000-000000000001", "sessionGeneration": 1, "revision": 6, "payload": { "transactionId": "40000000-0000-4000-8000-000000000001", "fromRevision": 5, "toRevision": 6, "utf8ByteLength": 11, "sha256": "b94d27b9934d3e08a52e52d7da7dabfac484efe37a5380ee9088f7ace2efcde9" } },
  { "protocolVersion": 1, "type": "editor.checkpoint", "requestId": "10000000-0000-4000-8000-000000000010", "sessionId": "20000000-0000-4000-8000-000000000001", "sessionGeneration": 1, "revision": 6, "payload": { "transferId": "30000000-0000-4000-8000-000000000004", "utf8ByteLength": 11, "sha256": "b94d27b9934d3e08a52e52d7da7dabfac484efe37a5380ee9088f7ace2efcde9" } },
  { "protocolVersion": 1, "type": "chunk.begin", "requestId": "10000000-0000-4000-8000-000000000009", "sessionId": "20000000-0000-4000-8000-000000000001", "sessionGeneration": 1, "revision": 6, "payload": { "transferId": "30000000-0000-4000-8000-000000000003", "purpose": "document.snapshot.response", "totalBytes": 11, "chunkBytes": 262144, "totalChunks": 1, "sha256": "b94d27b9934d3e08a52e52d7da7dabfac484efe37a5380ee9088f7ace2efcde9", "timeoutMs": 10000 } },
  { "protocolVersion": 1, "type": "chunk.data", "requestId": "10000000-0000-4000-8000-000000000009", "sessionId": "20000000-0000-4000-8000-000000000001", "sessionGeneration": 1, "revision": 6, "payload": { "transferId": "30000000-0000-4000-8000-000000000003", "index": 0, "byteLength": 11, "dataBase64": "aGVsbG8gd29ybGQ=" } },
  { "protocolVersion": 1, "type": "chunk.ack", "requestId": "10000000-0000-4000-8000-000000000009", "sessionId": "20000000-0000-4000-8000-000000000001", "sessionGeneration": 1, "revision": 6, "payload": { "transferId": "30000000-0000-4000-8000-000000000003", "ackedThrough": 0 } },
  { "protocolVersion": 1, "type": "chunk.end", "requestId": "10000000-0000-4000-8000-000000000009", "sessionId": "20000000-0000-4000-8000-000000000001", "sessionGeneration": 1, "revision": 6, "payload": { "transferId": "30000000-0000-4000-8000-000000000003", "totalBytes": 11, "totalChunks": 1, "sha256": "b94d27b9934d3e08a52e52d7da7dabfac484efe37a5380ee9088f7ace2efcde9" } }
]
